"COLUMBIA, S.C. — Just hours before the unemployment benefits fund was to run out in South Carolina, the state with the nation’s third-highest jobless rate, .,Gov. Mark Sanford relented .Wednesday and agreed to apply ,fpr a $146 million federal loan to shore it up, after weeks of refusing to do so."
"„ The governor's position had drawn rebukes even from fellow Republicans in the Legislature, one of whom denounced Mr. Sanford, as “heartless,” and from Newspaper editorial pages. On Wednesday, The State, the daily inewspaper here in Columbia, accused the governor of playing ,'jchicken with the lives of the 77,000” who are unemployed in .South Carolina. ."
"For weeks, Mr. Sanford, pewly .elected as head of the Republican Governors Association and iknown for being a fierce free-[Riarket foe of govern."" ant spending, stuck to his stand, questioning the probity of the South Caro-Jina Employment Security Com-itnission and demanding a new audit of the agency."
"» He has said in the past that he did not trust the commission’s calculation of the state’s unemployment rate, though a spokesman at the Bureau of Labor Statistics said it was calculated the same way as in every other state. !•; Mr. Sanford is now demanding that South Carolina’s Commerce Department, whose director ho ^appoints, be given access to .the .state unemployment agency’s Slumbers, including where applicants are from, their ages, genders and occupations."
"The back-and-forth dueling between the conservative governor (and the unemployment agency ;Jias gone on for weeks, and its executive director, Roosevelt T. Jfalley, warned that he would jiave to stop issuing benefit ; checks to the jobless beginning Jan. 1 if Mr. Sanford did not back down and ask the federal government for the loan."
"The steel industry, having entered the recession in the best of health, is emerging as a leading indicator of what lies ahead. As steel production goes — and it is now in collapse — so will go the national economy."
"That maxim once applied to Detroit’s Big Three car companies, when they dominated American manufacturing. Now they are losing ground in good times and bad, and steel has re- • placed autos as the industry to watch for an early sign that a severe recession is beginning to lift."
"The industry itself is turning to government for orders that, until the September collapse, had come from manufacturers and builders. Its executives are waiting anxiously for details of President-elect Barack Obama’s stimulus plan, and adding their voices to pleas for a huge public investment program — up to $1 trillion over two years — intended to lift demand for steel to build highways, bridges, electric power ., grids, schools, hospitals, water treatment plants and rapid transit ,	."
"“What we are asking,” said Daniel R. DiMicco, chairman and chief executive of the Nucor Corporation, a giant steel maker, ""is that our government deal with the worst economic slowdown in our lifetime through a recovery program that has in every provision a'buy America’clause.”"
"WASHINGTON - Presidentelect Barack Obama's economic recovery plan ran into crossfire from His own party in Congress on Thursday, suggesting that quick passage of spending programs and tax cuts could require more time and negotiation than Democrats once'nop ed."
Senate Democrats complained that major components of his plan were not bold enough and urged more focus on creating jobs and rebuilding the nation’s energy infrastructure rather than cutting taxes.
"Just hours earlier, Mr. Obama called for speedy passage of the stimulus measure, Warning that the recession “could linger for years” if Congress did not pass his plan within weeks."
"Further complicating the picture, Democratic senators said Thursday that they would try to attach legislation to the package that would allow bankruptcy courts to modify home loans, a move Republicans have opposed. [Page Bi.] ulus plan, the Obama team has also been considering how to use the second $350 billion of the bailout program approved by Congress. A transition team official said Thursday night that the new approach would give government officials broader range to provide relief on consumer loans for homes, automobiles and education, while also doing more to address foreclosures and the problems of municipalities and small businesses."
"S-For his recovery plan, meanwhile, Mr. Obama has been assembling a package worth as ftnuch as $775 billion over two years to revive the sagging economy, using the plan to define his presidency even before it begins |ind to foreshadow his broader approach to governing, r While relying on traditionally liberal notions of using government spending to spur growth, he has also tried to adapt it for a new era with investment in clean energy and technology. And he is trying to balance all of that with tax breaks that appeal to Republicans."
"Thanks to patients who still value their health in hard times, the recession has barely slowed the growth of concierge medical practices, which charge hefty membership fees for highly personalized care and around-the-clock access."
"Plummeting tax and fare revenues that have been depressed further by the ailing economy could increase the Metropolitan Transportation Authority’s budget deficit this year by $650 million, according to a new estimate made public on Monday. If the doomsday forecast is borne out, the authority’s deficit this year could grow to nearly $2 billion."
"The authority has already proposed a steep increase in fares and deep service cuts if it does not get a state bailout. But if its finances worsen significantly, it could be forced to take even more drastic measures."
"“This is obviously breathtaking,” Gary Dellaverson, the authority’s chief financial officer, said as he presented the projections to a meeting of the authority board’s finance committee."
"Transit officials also said that average weekday subway ridership declined 2 percent in January compared with the same month last year, probably because of shrinking employment in the region. It was the first time that that measure of subway ridership had fallen since 2003, except in months where the drop was attributed to bad weather or quirks of the calendar, like holidays falling on weekdays."
"Lower ridership also means less money collected in fares, worsening the authority’s fiscal straits. In January, the subway system recorded an average of"
"WASHINGTON - Even as they continued to hash out the details of a nearly S800 billion economic recovery plan, aides to President-elect Barack Obama on Sunday began lobbying a reluctant Congress to release the second half of the Treasury's $700 billion financial system bailout fund."
"The request is certain to generate angry debate on Capitol Hill, where lawmakers are reeling from last week’s projection of a $1.2 trillion budget deficit and will also soon be asked to vote on Mr. Obama's $800 billion recovery package."
WASHINGTON — The rising unemployment rate is giving President Obama’s critics an opportunity to raise questions about the effectiveness of his recovery plan and his economic leadership. The huge budget def-h icit is focusing fresh concern on J:tne national aeui.
"D A little less than four months -after he signed the $787 billion ,, American Recovery and Re-j! investment Act into law, Mr. Oba-i,ma is now in the position of try-j ing to convince Americans that the stimulus measure — his sig-,, nature legislative achievement „thus far — is working, even as the job losses mount."
"On Friday, the Department of Labor reported that unemployment was now 9.4 percent, the highest in 25 years, although the / rate of monthly job losses"
"MEXICO CITY — Mexico’s economy is being dragged down by the recession to the north. American addicts have turned Mexico into a drug superhighway, and its police and soldiers are under assault from American guns. Nafta promised 15 years ago that Mexican- trucks would, be allowed on American roads, but Congress said they were unsafe."
"other side as well. Many American communities are worried about drug violence spilling over the border, and about Mexican immigrants taking scarce jobs. That is forcing the Obama administration, already managing two wars and a deep recession, to fashion a new Mexico policy earlier than it might have wished."
"The 67-acre development on the Strip consists of six towers with 2,392 apartments, as many as 5,900 hotel rooms, a casino, and a shopping center and entertainment complex. Some of the world’s renowned architects have designed buildings for the project. Envisioned as a self-contained community, it will have its own fire department and power plant."
"Because of the credit crisis, City-Center’s owners found themselves in September 2008 unable to obtain several billion dollars that they had anticipated in loans from a consortium led by Bank of America. Though a $1.8 billion loan was eventually offered, the owners had to finance much of the project with their own cash. They had almost finished five towers when new problems erupted in February."
"III,the recession, the nation’s poverty, rate climbed to 13.2 percent,last year, up from 12.5 per-cent;in,2007, according to an annual report released Thursday by the .Census Bureau. The report also,documented a decline in employer-provided health insurance and in coverage for adults."
"The rise in the poverty rate, to the .highest level since 1997, por-tendseven larger increases this year,- which has registered far higher unemployment than in 2808/economists said."
"The' bureau said 39.8 million residents last year lived below the poverty line, defined as an' income1 6f $22,025 for a family of fout'.,l(;'1 ftf'anpther sign of both the recession and the long-term stag-nattSn'of middle-class wages, me-diatifafaily incomes in 2008 fell to $50,306,; compared with $52,200 the year before. This wiped out the income gains of the previous"
"""This is the largest decline in the first year of a recession we’ve seen since the Census Bureau started collecting data after World War II,"" said Lawrence Katz, an economist at Harvard University, referring to household incomes. ""We’ve seen a lost decade for the typical American family.” The share of American resi-, dents who said they lacked health insurance throughout the entire year remained steady, at 15.4 percent, or 46.3 million people. But the total masked some more worrisome trends that are helping to drive the debate over a national health care overhaul."
"Continuing an eight-year trend, the number of people with private or employer-sponsored insurance declined, while the number of people relying on gov-"
"The economy shrank at an accelerating pace late last year, the government reported on Friday, adding to the urgency of a stimulus package capable of bringing the country back from a recession that appears to be deepening."
"The actual decline in the gross domestic product — at a 3.8 percent annual rate — fell short of the 5 to 6 percent that most economists had expected for the fourth quarter. But that was because consumption collapsed so quickly that goods piled up in inventory, unsold but counted as part of the nation’s output."
"“The drop in spending was so fast, so rapid, that production could not.be cut fast enough,” said Nigel Gault, chief domestic economist at IHS Global Insight. ""That is happening now, and the contraction in the current quarter, as a result, will probably exceed 5 percent."""
"The dismal fourth quarter, and the likelihood of more of the same through the spring, are fueling discussion among policy makers and politicians over the best way to spend the soon-to-be-authorized federal money."
"6.2	percent, with universities pulling in a total of $31.6 billion, the highest amount ever recorded, according to the survey."
"BOSTON — Scores of legal aid societies that help poor people with noncriminal cases — like disputes over foreclosures, evictions and eligibility for unemployment benefits — are being forced to cut their staffs and services, even as requests for help have soared."
"In an odd twist, the societies have been hit hard by the Federal Reserve's steep reduction of its benchmark interest rate, which finally plunged last month to near zero."
"The rate decline, though generally welcomed as a blow against the recession, has had an unplanned and severe effect on legal aid societies, which depend heavily on revenues that are tied to the federal funds rate. As recently as 2007, the rate was more than 5 percent and legal aid agencies reaped more than $200 million for their operations."
"Now, for many legal aid groups across the country, cutbacks in staffing are expected to reach 20 percent or more over the coming months, even as requests for their services have risen by 30 percenter more."
"low-wage workers’ salaries commensurate with the cost of living, voters approved a change to the State Constitution that requires the minimum wage to be adjusted with inflation. As a result of the change, the minimum wage in Colorado has risen along with the cost of living. But this is the first time officials are faced with the prospect of lowering the wage to keep pace with a faltering economy. The federal minimum wage is S7.25 an hour, and it is illegal for most businesses in Colorado to pay workers less than that, so virtually all low-wage workers will see a drop of only 3 cents per hour. But advocates for poor Coloradoans say even that slight drop is enough to hurt people."
"For more young adults, there	s>ons- Twelve percent had got-	home in the past year. Accord-	and 48 percent of women were	adults 18 to 29	who lived alone is no place like home for the	ten a roommate to share ex-	ing to Pew, of all grown children	either still under the same roof	declined to 7.3	percent in 2009"
"holidays, and for the rest of the	penses. Fifteen percent said	who lived with their parents, 2	as their parents or had moved	from 7.9 percent in 2007,' ac-' year, too. Ten percent of adults they had postponed getting in 10 were full-time students, back home..	, cording to the Current;Pppulsf."
"younger than 35 told the Pew married, and 14 percent said one-quarter were unemployed A smaller share of 16-to-24- tion Survey. A decline that big Research Center that they had	they had delayed having a baby,	and about one-third said they	year-olds ,-^;46 percent-iscur-'; .’was recorded only twice beforj; moved back in with their par-	In the Pew study, 13 percent	had lived on their own before re-	rently employed than at any	over three decades, in the early"
"ents because of the recession.	of parents with grown children	turning home.	time since the government be-	1980s and the early 1990s during"
"WASHINGTON — After months of focusing on Afghanistan and health care, Prudent Obama turned his attentibrf oil Thursday to the high level of job-lessness, but offered no promise that he could do much to bring unemployment down quickly even as he comes under pressure from his own party to do more:"
"At a White House forum, scheduled for the day before:the government releases unemployment and job loss figures for November, Mr, Obama sought new ideas from business executives, labor leaders, economists and others. Confronted with concern that his own ambitious agenda and the uncertain climate it has created among employers have slowed hiring, the president defended his policies."
"Mr. Obama said he would entertain “every demonstrably good idea” for creating jobs, but he cautioned that “our resources are limited."""
"Speaking at the final session of the fifth annual National Forum of Labor. Agriculture and Industry at the University of Wyoming, he ■said: “Partly as a result of this cushioning operation of the government budget, consumers’ expenditures have held up rather well and the recession has been largely confined to its original source, namely business inventories.”"
"Reporting that the gross national product had declined by an annual rate of $10,300,000,000 from the fourth quarter of 1948 to the first quarter of 1949. Mr. Williams said that “if we did not have a stabilizing budget, private income would have fallen by' an equal , amount.”"
"Because of the principle, he said. ?o,400,000,000, or more than half the decline in total national income was concentrated on government. At the same time the decline in private income was limited to S4,900,000,000."
Gold shares still were in moderate demand and small gains were made by the favorites. Diamonds returned to favor and DeBeers closed fractionally higher. Base metal shares held at overnight levels.
The armistice between Israel and Egypt was hailed as a promise t of peace in the Near East by some rabbis is sermons here yesterday. Other rabbis preached on brotherhood and the economic “recession.”
"I While insisting: that they had largely succeeded in stepping unemployment insurance payments to longshoremen “seeking work” in the Catskill Mountains, and garment workers doing likewise in Miami, state and Federal insurance officials announced yesterday a new plan for further reducing such chiseling. It was disclosed that in this connection New York has closed its special office for unemployment compensation at Miami."
"ever, that a claimant be able and willing to work. Thus, New York has asserted the principle that a ! claimant who moves to a location where there is no market for his type of services has ""removed himself from the labor market,” and therefore is ineligible for unemployment compensation."
"LOS ANGELES, Sept. 1—'William Green, president of the American Federation of Labor, said today that present unemployment ""does not herald a depression and we’ll come out of it in a reasonable amount of time.”"
"The rising level of unemployment, however, Mr. Green said, called for general improvement in unemployment compensation systems, which he described as inadequate in both the extent of their coverage and the level of benefits."
"Dr. John R. Steelman, assistant to the President, made this recommendation in reporting that the Government had alleviated joblessness materially within three months in thirty-five critical areas in fourteen states by channeling into them 572,842,508 in Federal purchases, construction contracts and business loans."
"He disclosed that in September, at the close of the trial run, thirty of the thirty-five areas reported declines im unemployment and twenty-six actual employment increases. The increases in eleven of these areas was 3.5 to 14.3 per cent."
"""For the area of heavy unem-j ployment as a whole,” he stated, ""the decrease in unemployment has been relatively substantial.” Decrease in Jobless Rolls"
"Unemployment through the country fell off during the corresponding period, the report showed, from an estimated peak of 4,095,000 during the week ending July 9 to ""Because of the scope and complexity of government procurement. construction and loan operations,” the report said, ""the program did not get into full swing until toward the end of the quarter. It is believed, therefore, that succeeding reports will show greater concentration of activities in areas with serious unemployment."""
"WASHINGTON, Sept. 30—Unemployment declined from 3,689,-000 in August to 3,351,000 in September, according to the latest Census Bureau figures released today. This was the second successive decline in monthly unemployment figures."
"gratifying as ""it further bolsters accumulating evidence that general business conditions are improving.”"
"The Secretary warned, however, that any military assistance ""must be provided in such a way that it will not detract from the progress of economic recovery.” The Administration has indicated that it would prefer not to provide arms with funds taken from the Economic Cooperation Administration's appropriation. If the funds were not derived from this source, a separate appropriation would be needed."
"On the heaviest volume of business since early last December, the stock market broke through yee-• terday to new high levels of the . current upswing as prices moved , forward from 1 to approximately , 4 points. The return of motors and , steels as the prime instruments of strength, and a fresh surge in the , rails produced a lively final hour when one-third of the day’s volume took place. This last-hour turnover raised transfers on the Stock Exchange to 1,970,000 shares from 1,110,000 on Thursday*"
"Throughout the we eh the mar-ket had indicated a willingness to break through the resistance level, but on each occasion it was held back to some degree by realizing. Yesterday, however, lack of early pressure combined with the successful “riding out"" of the critical lunch hour to invite fresh bidding in the late afternoon. The greatest contribution to the advance in technical terms was supplied by the rail division which previously this week had alternated between an aggressive and cm indifferent attitude."
"to have any telling effect on prices as strength shifted in the first hour between the industrials and rails, while the motors assumed definite leadership as trading neared midday. Business for the forenoon totaled 660,000 shares. The list reached new high ground for the movement during the lunch period, after which outstanding gains and increased interest showed up In the steel section. Some slight profit-taking was encountered in the last few minutes of business, but the gains were well maintained."
"Chrysler was the outstanding issue among the automotives with a jump of 3% points, although this was under the peak rise which was 4% points to a new top of 104%. General Motors ended near the top mark of the movement with an advance of 1% points. Others In the motor division were raised from fractions to a point in Studebaker, Hercules and White Motors."
"Republic, most active in the steel section on 24,300 shares, was up 2 points. United States Steel scored an advance of 2% and Colorado I Fuel & Iron shot ahead 1% points on a volume of 23,300 shares. Bethlehem, Jones & Laughlin and Youngstown were increased by a point or slightly more."
"Twelve hours remain—from 11 o’clock this morning until 11 tonight—for New Yorkers and visiting cousins to see the spectacle, for the first time since 1941, known as the National Motor Boat Show. Whether they are using inflation dollars or not, the fact remains that visitors to the Grand Central Palace have heen buying an unprecedented number of cruisers, runabouts, outboards, motors and gadgets that probably will total $5,000,000 for the week. >"
"The stock market yesterday came close to the year’s previous high, with prices up 1 to 3 points and the average raised by 1.25 points. Some easing occurred during the last few minutes of trad-/ ing, but most issues managed to retain the early gains."
"Idle funds, which lately have been a source of underlying strength to the share list, came out in greater force than recently. This reinvestment demand enlarged business on the Stock Exchange to 1,590,000 shares, the best since May 19, against 1,020,-000 shares on Thursday."
"Allied Chemical finished at 189. or a new high for the year, on a gain of 3 Vi points. Union Carbide, also at a fresh peak of 110%, added 2% points. General Motors only scored an advantage of % point at 60 Vi while Nash and Studebaker both rose the same amount. Bethlehem Steel ended at 90 for an increase of lVi and United States Steel at 75, the top of the day, was up 2% points."
"WASHINGTON, May 9 (JP\ — Census Bureau statisticians said today that unemployment figures show no sign of a business recession."
"Newspaper publishers and other executives, here for the annual Newspaper Week meetings, said yesterday that business and industry throughout the country generally were still flourishing despite fears in some quarters of a recession."
"ALBANY, April 14—Gov. Thomas E. Dewey has approved the Young-Demo Merit Rating Bill, enabling employers in New York State whose payrolls are stable to get 5140,000,000 in tax credits this year to be applied against their liability to the ""Unemployment insurance fund next year."
"One of the most controversial measures to be considered at the I recent session of the Legislature, the bill had been fought by both the State Federation of Labor and the State Congress of Industrial Organizations. They contended it would weaken the unemployment insurance fund, which is used to pay benefits to jobless workmen, and that it unduly favored larger business establishments."
The Young-Demo bill was virtually the only piece of major legislation on which Governor Dewey took no stand when it was before the Legislature. Its fate was uncertain until his approval of it was announced today. Mr. Dewey gave no reasons for his decision.
"Two major changes in existing law governing the granting of unemployment insurance tax credits are made by the bill, which was sponsored by Senator Fred A. Young and Assemblyman Benjamin Demo, both Republicans of Lewis County."
Concern about the slowness with which the bank is getting under way has increased considerably in I Britain since the recent industrial | crisis. February’s shutdowns forced the revision of a number of as-; sumptions as to how this country's precarious international economic position was to be brought into balance with the aid of United States and Canadian credits.
"With many traders literally snowed under, the stock market yesterday drifted lower and prices at the close were down ~ fractions to 2 points. Trading was quieter than in recent sessions and the volume in the Stock Exchange fell to"
