"But before concluding that a booming economy has succeeded where government job training and affirmative action programs have failed, we should recall some elementary facts of economic history."
There is good reason to think that a similar reversal will happen again once the current expansion ends.
"“We no longer have the luxury to look primarily to the flow of goods and services” when making decisions about interest rates, Mr."
"The stock market, in response to Mr. Greenspan’s remarks, which were delivered at an annual conference on monetary policy issues organized by the Federal Reserve Bank of Kansas City, fell moderately today. The Dow Jones industrial average dropped 108.28 points, or near-' ly 1 percent, closing at 11,090.17 in light trading. [Page C3.J"
"Relying on the surplus reduces the sacrifices that would be necessary from today’s workers and tomorrow’s retirees, and for that reason Republicans, too, have generally endorsed allocating a big portion of the surplus to Social Security."
"Mr. Clinton has alluded in general terms to the need for measures in addition to using the surplus, but has avoided specifics, while Republicans have been silent or called for solutions that require neither tax increases nor benefit cuts."
"the White House’s Social Security proposal, saying that its call for the Government to invest $700 billion in the stock market would result in political meddling in the free enterprise system. But Mr. Greenspan was supportive again today of Mr. Clinton’s call for a large portion of the surplus to be used to bolster Social Security by paying down the national debt."
"These are astounding economic times. Overseas, Europe is slowing, most of Asia is in recession $nd Brazil threatens to drag down much of South America. But in the United States, consumers are spending with abandon and economists continue to toe surprised by how robust the economy is."
"It was against that background that Alan 'Greenspan, the chairman of the Federal Reserve Board, testified before the Senate Banking Committee yesterday. He again predicted that the economy would slow this year, and again warned that stock prices appeared to be overvalued."
"More than any other factor, the long decline in the value of the dollar appears to have pushed up the inflation rate in recent months."
"In the absence of cheaper foreign products, the manufacturers of many basic materials, like chemicals, plastics, paper, steel, copper and liner-board, have managed to impose hefty price increases that feed inflation."
"“The weak dollar is finally showing up as an inflation factor,” said John D. Paulus, chief economist for Morgan Stanley & Company."
"Unusually Strong Jump Such increases, some of them more than 20 percent last year, are a major reason why the national inflation rate is higher today than it was last summer. Inflation took an unusually strong jump in January, raising an alarm that it might be getting out of hand. In response, the Federal Reserve pushed interest rates up noticeably last week, hoping to discourage the borrowing and constant buying that help generate inflation."
"President Bush’s plan to resolve the financial troubles of the nation’s savings industry is based on assumptions that interest rates will decline sharply and deposits increase steadily in coming years, according to figures made available yesterday by the Office of Management and Budget."
"The projections were immediately criticized by some private analysts, who said the figures were based on an overly optimistic view of the economy, interest rales and inflation over the next 10 years. They said the plan underestimated the true cost of the rescue by many billions of dollars."
"“The interest-rate projections are wildly optimistic,"" said Bert Ely, a consultant in Alexandria, Va."
The new figures added to the debate that has surrounded the rescue plan since it was announced two weeks ago.
"WASHINGTON, Jan. 24 - In an unusually direct statement, Alan Greenspan, chairman of the Federal Reserve Board, said today that the nation’s inflation rate was unacceptably high and that he would seek to reduce it."
Mr. Greenspan’s remarks raised the possibility that short-term interest rates might be pushed higher.
"""Our strategy continues to be centered on moving toward, and ultimately reaching, stable prices — that is, price levels sufficiently stable so that expectations of change do not become major factors in key economic decisions,” Mr. Greenspan told the House Banking Committee. “Current inflation rates, by that criterion, clearly are too high and must be brought down.”"
"The. nation’sijtrado deficit grew ■ ; sharply in August! to $10.8 ‘ billion, as imports surged and. exportS'Slipped.- Page Dl /'"
"It is time to come to grips with the economic challenges of raising efficiency, rather than contenting ourselves with controlling surface symptoms, such as inflationary pressure, which, while important, do not get at the fundamental problems. Those problems apply north of the border as well.	Alan	Abouchar"
"Your advocacy of motor fuel price increases to raise revenue and reduce the Federal deficit (editorial, Dec. 12) reflects a widespread misunderstanding that has too long characterized pricing policy for public services: the stale is somehow expected to provide all the highway infrastructure and allow use without reference to imposed cost."
"Sales taxes on road-related products are merely indirect taxes, like those on clothing or chocolates, and when there is a need for more revenue to reduce the inflationary impact of large deficits, sales taxes provide a ready source. The “nickel tax"" increase passed in 1984 was the most recent example of such thinking. Like most other road-sector fees and taxes throughout North America, it failed to come to grips with the challenge of economic efficiency, which requires that, since trucks do damage that varies exponentially with their weight, the prices they should pay to"
"CHICAGO Aug. I — If one thing was clear at the close of the 81st annual meeting of the National Governors’ Association today, it was that the Federal budget deficit will place a growing burden on the states and make innovation far more difficult."
", WASHINGTON, June 21 (Reuters) — The United States budget deficit rose to $25.47 billion in May, higher than the $22.58 billion deficit in May 1988, the Treasury Department said today."
"In the first eight months of the 1989 fiscal year, ending Sept. 30, the budget deficit shrank to $113.32 billion, from $128.43 billion in the comparable period a year ago, the department said."
"The Bush Administration has projected a rise in the deficit to $163.3 billion for the 1989 fiscal year, from"
Prices spurted across the maturity spectrum immediately after release yesterday morning of a smaller-than-anticipaled March trade deficit.
"Specifically, the 7.4 percent increase in exports, to a record $30.78 billion, showed continued strength in the manufacturing sector."
"The figures suggest that upcoming revisions to economic growth statistics for the first quarter will not be pushed downward, a move some economists had said might occur if the trade report was not particularly strong. In addition, the strong export growth diminishes the possibility that the Federal Reserve Board might move soon to ease credit conditions."
"The export figures, coupled with a report from the nation's purchasing managers earlier this month suggesting that export growth was vibrant in April, suggest that an important component of the economy remains vigorous. The Fed is not likely to ease policy as long as the manufacturing sector remains strong."
"Prices of Treasury notes and bonds slipped in light trading yesterday, as dealers sold securities after a report from regional Federal Reserve banks showed that the economy remained a bit stronger than anticipated."
"While the report, which is referred to as the ‘‘beige book” or ‘‘tan book,” was cited as the main source of selling pressure, some participants said the activity had the scent of a shift in sentiment."
"“The specific excuse you will hear is that the tan book didn’t show enough evidence to let the Fed ease policy,” one Government-bond trader said. ""But the market is trading very poorly. Dealer positions are larger than the pace of business."
"In addition to the beige book, which said the economy was ""stable to modestly expanding"" in November, market participants reacted to comments from an unidentified senior Federal Reserve official that appeared on the Market News Service."
"The lower trade balance signals that the United States is becoming more competitive. Administration officials and many economists hailed the report as an indication, in particular, that improvement has been achieved despite the run-up in the dollar since the beginning of the year."
"The September figure of $10.5 billion, an improvement of $1.8 billion from August, reflected both higher exports and lower imports. Page Dl."
"WASHINGTON. Nov. 16 — The United States trade deficit shrank to $10.5 billion in September, a double-barreled $1.8 billion improvement that reflected both higher exports and lower imports."
"While today’s Commerce Department report was well within the expectations of most experts, the new data and other economic figures tended to confirm recent indications that the economy has probably not slowed to any significant degree."
"WASHINGTON, Oct. 24 — The Treasury said today that Taiwan and South Korea were manipulating their currencies to stimulate sales of their goods to the United States, thereby impeding a reduction of the big American trade deficit."
"In a report to Congress on international economic policy, the Treasury also sought to rebuff those economists and international authorities who maintain that the dollar should fall still further. The dollar has fallen about 40 percent since February 1985, when it reached its peak against other major currencies. The dollar’s decline was intended to help narrow the trade deficit, which reached a record $170 billion last year."
"The impact will soon be felt by small businesses, which remain heavily dependent on banks for loans, and by consumers, whose payments on home-equity loans and variable-rate credit cards will rise. Although the higher prime rate could affect consumer spending slightly, it is unlikely to be a major drag on the economy."
"One Day After Testimony The rise in the prime rate came one day after Alan Greenspan, chairman of the Federal Reserve Board, indicated to the Senate Banking Committee that he would be prepared to raise interest rates further if inflationary pressures worsen. His remarks, however, implied that he saw no reason to do so now."
"TORONTO, June 19 — Officials of the leading industrial countries sought here today to dispel speculation about a coordinated move toward a substantial increase in world interest rates because of signs of rising inflation."
"This time, however, the official said, American rates have risen a bit this year, while German rates have not risen as much. “But nobody’s saying a tightening of money is going on,” the official added."
Suspicion of a rise in rates coordinated by the leaders of the seven nations attending the economic summit conference has arisen in recent days in world financial markets.
"WASHINGTON, June 14 — In a report that was far better than expected for the second straight month, the Government said today that the nation’s trade deficit shrank 15.5 percent in April, to the lowest monthly point in more than two and a half years."
"Imports, which had remained at stubbornly high levels while their prices in dollars rose, fell sharply in April. Exports slowed only slightly from their recent torrid pace."
"The $9.9 billion trade deficit in April was the smallest since August 1985, when the figure was also $9.9 billion. No monthly level has been lower since the $8 billion of December 1984."
"The April trade deficit was at least $2 billion less than most predictions, and the report set off major rallies in the bond and stock markets and lifted the dollar's value. The latest Commerce Department data seemed, among other things, to make it more likely that inflation could be contained without having to use strong countermeasures involving higher interest rates."
"“It’s a shocker,” said Daniel Friel, an economist, of the trade report. As a result, he sees “very little pressure fori the Federal Reserve to tighten"" because the booming export-oriented manufacturing sector may be getting “some respite” and American consumers seem to be curbing their own demand for goods. Mr. Friel is with the NCNB Corporation, a major bank holding company in the Southeast."
"According to the report, inflation picked up to a 4.7 percent rate during the spring, from 3.5 percent in the first quarter, as measured by the gross national product fixed-weighted price index."
"The report prompted fresh conjecture as to whether the Fed might decide to take yet another step in the series of small ones it has taken this year to raise interest rates, thereby slowing the economy."
"Erratic monthly trade figures make it impossible to read a trend until well after it starts. In monthly reports, the deficit peaked last November, shrank for two months, grew in February and shrank in March. But the reports were raw and incomplete. Only now does the Commerce Department’s quarterly report confirm substantial improvement in the first three months of this year."
"Inflation fears heightened last Friday when the Government reported that producer prices rose in March by six-tenths of 1 percent, the biggest increase since last spring. What happens to prices at the producer level tends to show up in consumer prices several months later."
"The decision is unlikely to have much immediate market impact because it largely ratified the status quo, and because the economic importance of the gray market has declined as the dollar’s value has fallen. Gray market imports are profitable only when foreign businesses sell their products overseas for much less than they sell them in the United States."
"Senator Albert Gore Jr. defines his positions on arms negotiations, the budget deficit and other issues in an interview conducted in advance of the New York State primary election."
"WASHINGTON, April 14 — In a major surprise, the nation’s trade deficit grew sharply to $13.8 billion in February, as imports surged more than, twice as much as exports, the Commerce Department reported today."
"Most economists and participants in the financial markets had expected some improvement, and word of the $1.4 billion widening of the trade gap caused the dollar to plunge and forced world central banks to intervene to restore stability. Bond and stock prices tumbled along a broad front as the dol-( lar declined."
"The Dow Jones industrial average ended the day down by 101.46 points, or 4.8 percent. The dramatic fall of stock prices, mainly in the afternoon, reduced the drop in bond prices by half, as many investors sold stocks and switched to more secure fixed-income investments."
"He could start by examining the new “Economic Report of the President,” his very own, beginning on page 32. It asserts that excessively tight monetary policy last year slowed growth, raised interest rates unnecessarily and helped bring down the stock market. The President might also request a copy of a January letter from Michael Darby, Treasury’s chief economist, to each member of the Fed’s Open Market Committee — the system’s policy-making council — arguing for loosening up now."
"In “A New Warning on the Trade Deficit” (editorial, Dec. 11), you sound the alarm over the trade deficit. Financial writers like Leonard Silk (Economic Scene column, Business Day, Dec. 11) warn that in a few years our total indebtedness to foreigners could approach $1 trillion if the trade imbalance continues."
Quite rightly you state that the experts aren’t sure how to fix it. To this conclusion we should add that under our current administration of trade policy there is very little likelihood the situation will improve.
"The stock market lurched downward yesterday as a return of volatile trading ended a fragile, five-day rally."
The Dow Jones industrial average fell sharply from the onset and was down as much as 115 points around 1
"P.M. It later recovered about half its loss, closing the day down 50.56 points, at 1,963.53, a decline of 2.51 percent."
"The tumble was set off in part, market analysts said, by nervous investors who bought in at low prices in the last week and were eager to take profits after the recent rally. A lack of progress in the negotiations in Washington on reducing the Federal budget deficit convinced these investors that the market upswing could not be sustained, the analysts said."
"WASHINGTON, July 2 — The nation’s unemployment rate declined two-tenths of- a percentage point to 6 percent in June, the Labor Department reported today."
"Although the rate has not been so low since late 1979, and in fact had been widely expected to show a slight increase, Government and private analysts agreed that the latest labor market data were considerably weaker than the - unemployment rate itself would suggest."
"The number of Americans with jobs actually declined 198,000, as measured by the department’s survey of households, and for the second straight month business payrolls showed only a lackluster increase."
"“It sort of puts into doubt the strength of the economy at this point,"" commented Maria F. Ramirez, an economist at Drexel Burnham Lambert."
"EXECUTIVE stock options, like other investment devices tied to the stock market, have been hurt by the October market plunge and accompanying financial turmoil. In fact, the price at which many of these options can be exercised is now much higher than the market price — which is known as being “under water.”"
"Because the exercise price is likely to remain higher for some time, compensation specialists report that companies — many of which are setting up option plans for 1988 — are considering the issuance of new options at lower prices."
"“Unquestionably the vast majority of companies will cancel the outstanding options and issue new ones at lower prices,” said Robert Salmen, a principal and head of executive compansation research at William M. Mercer-Meidinger-Hansen Inc., an employee benefits consulting firm. “We received the first inquiry on this on the Tuesday after the market crash.”"
"! Wall Street, shaken by the turmoil in the stock market, is slamming the brakes on what had been the greatest boom in American financial history. After a decade of unprecedented growth, fueled by a huge flow of profits, a new word is working its way into the financial lexicon: contraction."
"A strangely exuberant, magical era of soaring bonuses, bull markets, an endless flow of billion-dollar deals, multimillion-dollar fees and wholesale migrations from the nation's best business schools to securities houses appears to be coming to a close."
"J.	Lilt, a former securities industry consultant and now the chief financial officer of E. F. Hutton & Company, which announced on Friday that it was laying off 40 people in its municipal bond department. “This is real downsizing. The word for it industrywide really is contraction.”"
"There had even been some layoffs before Black Monday, Oct. 19, as some firms sought to trim their bloated ranks after doubling or even tripling in size over the last five years. The market collapse rattled managers who were unprepared to deal with such huge numbers of people in hard times."
"The Dow Jones industrial average, which has been marching up since August 1982, began a dramatic fall last week that continued through yesterday when it closed at 1,738.74. Shown: Weekly close of the Dow.'	Vi;v y \	yy"
"But today’s economy is better equipped to handle financial shocks. “I don’t see this decline in the stock market leading to a great breakdown in the economy,” said Robert A. Kavesh, a professor of finance and economics at the New York University School of Business. “There are still many elements of strength in the economy — profits are strong, for example.” Among the important differences between today and 1929 are Federal deposit insurance, unemployment insurance and Social Security insurance and other elements of what has come to be known as the safety net. These not only guarantee against widespread destitution; their very existence should also help to prevent the kind of financial panic that fed on itself in the Depression."
"WASHINGTON, Nov. 4 — The stock market collapse forced the impossible: a summit meeting between the White House and Congress on a deficit-reducing package."
"The talks are floundering because the White House and Congressional negotiators remain deeply divided over the same tax issues and military and domestic spending priorities they have fought over since 1981, and because pressure from constituents on the issue has been minimal."
"RUSSELL, Kan., Nov. 9 — Calling himself a candidate of America's heartland, Senator Bob Dole returned to his prairie hometown today to formally announce that he is a candidate for the Republican Presidential nomination. He put erasing the budget deficit at the heart of his Presidency."
At the same time Mr. Dole pledged to “tackle the runaway Federal budget head-on” through cuts in Federal spending except for those programs that “assist vulnerable Americans.” He vowed not to raise tax rates and said his fundamental goal was a balanced budget.
"NEWARK, July 10 — For 12 years, Nona Payton worked as a claims clerk in unemployment offices. Soon, she will return — as a client."
"Other workers have seen their salaries cut by as much as $10,000 a year because their positions were taken over by employees with higher Civil Service classifications who lost their positions through reorganization."
Merrill Lynch & Company said yesterday that it had lost $250 million this month because bonds that it owned plummeted in value when interest rates surged.
I Wall Street executives could not re-[ call an occasion when a securities firm lost so much in so short a time — ap-I parently little more than a week.
"j In the last few weeks the bond markets have been particularly turbulent, and one sector, municipal bonds, took its worst drubbing in years. The individual investors who dominate the tax-exempt market suffered losses of about 10percent. |Page Dl.]"
"Merrill’s losses came from $1.7 billion in transactions involving complex and volatile mortgage-backed bonds, according to officials at the firm and other Wall Street sources. Those trans-| actions went awry when those bonds tumbled in value."
"J.	Bennett has led the charge, accusing colleges of being greedy in pushing up tuitions at rates that reach double digits in some cases, and that far exceed increases for food, automobiles and other goods and services. At some top private schools, costs for 1987-88 will approach $18,000 per student."
"Stung by the accusations of • greed and inefficiency, the colleges and universities are striking back, arguing that, in an industry in which greater efficiency cannot be equated with personnel cutbacks, some of their costs necessarily go up faster than inflation."
"The Republic National Bank in New York at 4 P.M. quoted gold bullion at $447.00 an ounce, down $5.50 from Monday’s late bid."
Stock prices sulrged and interest rates tumbled yesterday as investors became increasingly optimistic that inflation has been checked.
"Stocks rose to record levels, with the the Dow Jones industrial average closing above 1,700 for the first time. It rose 17.09 points, to 1,713.99, in what was the fifth-busiest session in New York Stock Exchange history. The average moved past 1,600 as recently as Feb. 6."
"In the same three weeks, yields on 30-year Treasury bonds have fallen by a percentage point, to 8.29 percent, a remarkably sudden drop for the benchmark issue. Bond prices have risen 11 points during the three weeks, or $110 per $1,000 bond."
"finally setting aside their memories of 1979 and 1980, when inflation exceeded 10 percent and the bond markets were a disaster zone. Inflation causes havoc in the bond markets as investors demand higher interest rates to protect the value of their securities. When interest rates rise, bond prices fall. With yesterday’s decline in rates, bond prices soared."
"Interest rates stayed high in recent years because of investor nervousness that inflation might be rekindled. But now, after four years of inflation at 4 percent or less, and with important drops in oil prices pointing to a rate of 3 percent or less this year, investors are buying bonds with yields that would have been unthinkable just months ago."
"The reduction, the third this year, brought the crucial discount rate to its lowest level since the start of 1978."
"The discount rate, which the Federal Reserve charges on loans it makes to financial institutions, normally leads to widespread declines of interest rates charged businesses and consumers. The declines, in turn, tend to enliven the economy by encouraging individuals and corporations to borrow more and spend more."
"Earlier this year the Federal Reserve reduced the discount rate twice to stimulate the economy. On March 7 the rate was cut to 7 percent from 7>4 percent. Six weeks later, on April 18, the rate was cut to 6*4 percent."
