"With many traders literally snowed under, the stock market yesterday drifted lower and prices at the close were down ~ fractions to 2 points. Trading was quieter than in recent sessions and the volume in the Stock Exchange fell to 930,000	shares after nine consecutive full sessions of more than a million shares each. The volume on Wednesday was 1,180,000 shares.	'"
An important factor influencing trading continued to be uncertainty with respect to deflationary developments in Washington. Increasing opposition to the Marshall plan for aid to Europe and the difficult foreign situation also were factors that tended to check buying.
"The steel shares, among the groups, recently showing strength, were in rather heavy supply. United States Steel dropped 1% points to 78%, and Bethlehem Steel was down a point to 103. National Steel receded 1% points to 90%. Among the motors Chrysler lost a point to 62% and General Motors, % to 57%. In the rubber group, Goodyear receded % point to 43%."
"The rail shares yielded from large fractions to more than 2 points, probably reflecting in part reports from Washington that the decision by the Interstate Commerce Commission on the applications of the carriers for a rise in freight rates would-be delayed until well into 1948. Nickel Plate was down 2 points to 45, Santa Fe 1% to 94%. Union Pacific and Southern a point each at 159 and 39, respectively. Pennsylvania, most active of the rails, declined % to 17%."
"WASHINGTON, Dec. 19 — The House briskly passed the Senate-approyed anti-inflation resolution without change today and sent it to the White House. The vote was 281—73."
"The country should alter its fi-l nancial policy by curtailing: Government spending and reducing taxes to allow more money fo. capital investment before resorting to price controls in an effort to curb inflation. So said James L. Rogers, president of the American Pharmaceutical Manufacturers’ Association, at the opening session of a three-day meeting of the association at the Waldorf-Astoria Hotel yesterday."
"Mr. Rogers said that Attorney General Tom Clark in a recent address ""gave high praise for the drug industries’ success in holding prices down. He reported a price increase of 3.1 per cent on 7,000 drug store items during the period, 1939 to 1947.” Mr. Rogers also urged the manufacturers to ‘ continue to do research to the greatest possible extent and support all worthwhile research organizations in our field” in order that the drug industry may remain on its present high plane and come to ‘‘greater heights of usefulness and service ;al care under Government control far below the general average that prevails in the United States. Much of this must he related to economic difficulties, the lack of a middle class with some 90 per cent of the people listed as poor, to mdernutrition,” he said, ""and, as-ociated with such undernutrition, ailure of production.”"
";al care under Government control far below the general average that prevails in the United States. Much of this must he related to economic difficulties, the lack of a middle class with some 90 per cent of the people listed as poor, to mdernutrition,” he said, ""and, as-ociated with such undernutrition, ailure of production.”"
"WASHINGTON, Nov. 1—President Trumap was urged today in a report of his Council of Economic Advisers to seek renewal of some war-time powers to deal with a threatened inflation of industrial prices under the combined impact of heavy domestic demand and a $20,000,000,000 European recovery program."
The report warned that serious inflation already existed in prices of food and steel. It said the nation’s ability to support a European recovery program of the proportions contemplated already had been demonstrated but warned of serious trouble ahead unless “firm measures” were taken to counteract current trends.
On receipt of the report. President Truman issued a public statement calling attention to the fact that it and the report on national resources and foreign aid by the Secretary of Interior Julius A. Krug found that the United States had the resources and economic and financial capacity to support a considerable European aid program.
"Mr. Truman said these reports and other pertinent material would be the basis for his recommendations to Congress. Today, again, Mr. Truman limited his callers to a minimum and continued his work on the message to the session of Congress opening on Nov. 17. In this message he will outline a program for checking inflation and aiding Europe."
Strategists of both parties saw as one aim of the President's proposals to combat the inflationary spiral a gesture to mollify the rebellious leftist fringe within the Democratic party that has been flirting with the idea of a third party. It was thought that a particular concession was made by the President in asking for the imposition of price controls on items in scarce supply.
"For the Republicans, Carroll Reece, national chairman of the party, asked what had made the President change his mind about the need for price controls."
"New York housewives .found meat prices reduced 2 to 7 cents a pound in most butcher shops yesterday, thirteen days after wholesale prices had started slipping from near-record highs. Markets Commissioner'"
"The imposition of wartime controls upon a peacetime economy would “go far to upset our economy” and would continue a state of scarcity, Morris Sayre, the NAM president told the Senate Banking Committee, conducting hearings on a number of anti-inflation bills."
"On the other hand, John Middle-kamp, appearing for the Automobile Manufacturers Association and as a spokesman for the automotive industry, described controls as “a boomerang in the battle against inflation” and held controls would only impede production, increase price and foster inflation."
"Industry’s anti-inflation program, Mr. Sayre told the committee, calls for reduction of government spending and taxing, and systematic retirement of the public debt. Labor is asked to forego demands for further general wage increases without corresponding i increases in productivity and to set aside all featherbedding rules and unnecessary restrictions on individual productivity."
"Reading in THE Times of Jan. 1 th« New Year’s message of Treasury Secretary John W. Snyder that individual' saving is America’s “most potent weapon in combating inflation,” r found' myself intrigued but nonplused. For I; knew that today, with an insurance premium, several bills, and an income-tax installment coming due, I would have to draw upon what savings I had already accumulated. This morning, for the third time in six months, I took several war bonds from the safety-, deposit box and sold them across .the counter.	__"
"There are, to he sure, many persons whose income has greatly increased since Pearl Harbor and who are even-embarrassed by surplus funds. These may well heed Mr. Snyder’s injunction to save. But the Secretary overlooks the salaried professional man who fi£s spent much time and money in preparation for an expert vocation and’is grievously hit by inflated prices."
"With a salary which was adequate when Mr. Snyder took office and which has increased slightly since then, I, as a teacher, am now unable to make ends meet decently without using my savings. Our family of five live respectably but frugally, denying ourselves certain amenities which we took as normal a few years ago. My wife and I seek to hear our own weight and maintain insurance and annunity provisions sufficient to educate our children and provide for our old age without appeal to either charity or public relief funds. We consider this course indispensable to the true American tradition, but it is touch and go as to whether we can continue it."
"Many in the teaching profession are less fortunate. Some, for purely financial reasons, have had to leave college or university faculties to enter business or government. We wonder whether our fellow-citizens realize the toll which inflation has already taken from many persons and institutions whose distinctive contributions our country and the world definitely need.	“"
"Since last week two of the staples on today’s shopping list have gone up 10 per cent, an increase greater than that made by my bonds in the four years in which I had treasured them. I wonder where to find the individual savings which Mr. Snyder asked me to put aside to beat inflation."
"i The stock market lapsed yesterday into an indecisive stage accompanied by a contraction in business. The inability of the railway issues to further their previous strength caused some misgivings in trading circles, but the oils still continued to push forward although the advance failed to be as uniform as recently. Fractional price alterations ruled in the majority of issues on the Stock Exchange with a few petroleums raised more than a point, but the combined averages were lowered 0.02 point on the day."
"It was the dullest session in two weeks, and transfers on the Exchange decreased to 1,250,000 shares from 1,520,000 on Thursday. The Exchange announced a decline of 154,239 shares in short interest accounts as of June 15 from the previous month."
"Registering the first contraction after twenty-three consecutive weeks of expansion, commercial, industrial' attdf: agricultural loans of the reporting New York City member banks of the Federal Reserve System were reduced $77,-000,000 during the week ended on Wednesday, it was disclosed yesterday. The Federal Reserve Bank of New York, in releasing the data, pointed out that ■ repayment • of loans on tobacco, and by distillers, aircraft manufacturers and oil companies were most prominent in the week’s reduction."
"Total loans and investments were $184,000,000 less, while loans dropped- $358,000,000. • Borrowing by brokers and dealers for purchasing or carrying United States Government obligations were down $113,000,000, and on other securities. this group lowered commitments $132,000,000. Loans to nondealers on the governments were down $4,000,000 but on other .securities, . these traders took an' additional $15,000,000."
"If the rest of the steel industry institutes lower prices to the same degree as United States Steel, the nation’s steel bill will be lowered by $75,000,000 to $100,000,000 an-: nually, according to one industry official. Big steel’s reductions, which become effective on May l,j amounted td $25,000,000."
"The Bethlehem, in a statement issued here by E. G. Grace, chairman, said that its price reductions would amount to $10,000,000 on an annual basis, but, like United States Steel, it did not report the specific reductions on the product involved. Jones & Laughlin and Youngstown Sheet and Tube did; not place a value on the reductions, I contemplated."
"“This is the first attempt of any union in this area to assist its members in combating high prices,” Mr. Annable said. He said further, that if successful, the local would introduce “many other necessities” to help meet today's increased living costs."
"WASHINGTON. July 30—President 'Truman continued today his demands on Congress for curbs against inflation, warning that avoidance of a “business collapse,” which he foresaw without his program, was prerequisite to a peaceful world."
"Mr. Truman was markedly more temperate in tone than in the message he personally delivered to Congress Tuesday, but the sense of economic urgency with which he viewed the “growing threats to our well-being” Was no less apparent."
"“I realize that the anti-inflationary program I have offered will impede some business plans, will curb some profit opportunities. and may liriiit some wage advances. It is of the very essence of a plan to counteract inflation that this be done. All groups will ultimately benefit when it is done."
"Financing of the country’s grow-, ing volume of expenditures has! been possible, according to the bulletin, from rising personal incomes, business profits and Governmental revenues, supplemented by reductions of liquid asset holdings by many businesses and individuals and by growth in private, state and local government debt, includ-"
"Commenting yesterday on the President's appointment of Paul Porter, former OPA head, as his adviser on anti-inflation legislation, we suggested that the move seemed almost deliberately calculated to destroy at the outset any hope of cooperation on legislation in this field. If the naming of Mr. Porter did not accomplish this result, then the bill introduced yesterday by Senator Barkley, presumably reflecting the ideas of this adviser, should certainly do so. If any measure ever was put forward by an Administration with its tongue in its cheek, this is such a measure. No intelligent Congress, Republican or Democratic, could possibly stomach this bill, and the Administration must know it."
"The proposed legislation includes the whole hodge-podge of recommendations contained in that part of the President's message dealing with rising prices and living costs. But that is not all. A pleasant surprise has been added by way of giving this legislation the authentic OPA touch. For it includes, as it were, an invitation to revisit that Alice in Wonderland of economics in which the country lived during the reign of OPA. That is the land of Let's Pretend, whose chief industries are statistics and regulations, in which high taxes and black market prices don't count, and where the basic philosophy is that inflation that you can't see can't hurt you."
"Those who may have wondered precisely what Mr. Porter's contribution to the anti-inflation campaign was going to be do not have to wonder any longer. The secret is out. Incredible as it may seem, the surprise is Price Roll-backs. Roll-backs would be applied to any cost-of-living item which has risen “or which threatens to rise"" 20 per cent or more since June, 1946 (when price controls were scrapped). Prices picked for the roll-back would remain under ceilings until June* 30,"
"There is no magic, of course, by which the Administration or any other human power can ""roll” prices back, by word of command, to some appointed level. The term “roll-back” is simply a euphemism to describe a process whereby a producer is induced to sell his product at an agreed price, with the difference between that price and the market price made up to him by government subsidies. And the cost of the subsidies? That, of course, is footed by the taxpayer."
"Subsidies are to be distrusted under any conditions, and distrusted particularly when they come, as they come in the case of price roll-backs, in disguise. But the proposal to reintroduce them into the American economy at the present time represents a new high in economic futility. Britain has been chided by her critics for spending almost two billions a year since the war to hold food prices down. We can be charged with the even greater folly of having spent similar amounts to keep farm prices up. But, never until now has it been seriously proposed, here or anywhere else, that a nation’s taxpayers shoulder the burden of subsidizing price inflation in one political area and price deflation in another, at one and the same time."
"Leaders of the Republican party in Congress returned President Truman's fire by radio tonight, describing his call of a special session as unnecessary and declaring that his anti-inflation proposals would make high prices per-1 manent."
"Senator Robert A. Taft of Ohio, chairman of the party’s Senate policy committee, promised that Congress would try to work out some cost-of-living curbs without resorting to “police state methods,” but he declared that “price I control and rationing will not work in America in time of peace.” Asserting that Congress was going to go home in about two weeks, he said that “we would be fully justified in adjourning at once.”"
"WASHINGTON, July 24—President Truman, cruising on the Potomac in his yacht, the Williamsburg, worked today on the message he will deliver to the reconvened Congress on Tuesday, while indications continued that he would gite first emphasis to his anti-inflAtion program and Federal housin'#/ h •’"
"Many American companies are laying off workers now, rather than waiting to be hit by hard times as they have in the past. Some economists warn that this outburst of corporate preventive medicine increases the odds of a steep recession."
"The number of people laid off in the United States has increased sharply since June, reaching the levels of the early months of the 1981-82 recession. While some companies, including Citicorp, Digital Equipment and McDonnell Douglas, are acting because sales and profits have already begun to shrink, many others, including General Electric’s appliance division and Nordstrom department stores, are only anticipating such a downturn."
"“Businesses are scared and they are cutting costs in anticipation of what they think might happen,” said Stephen S. Roach, a senior economist at Morgan Stanley & Company. ""That sort of costcutting keeps American companies competitive in the world marketplace. But pre-emptive layoffs can be self-fulfilling, frightening people into spending less, which further weakens the economy.”"
"The layoffs, and a smaller number of outright dismissals, in recent months have come in the service sector as well as in manufacturing, reflecting a new interest in cost-cutting, particularly among retailers and financial-services companies. Manufacturers have practiced this sort of cost-cutting for a decade to make themselves more competitive."
"If these principles are respected, it’s possible to raise $300 billion in revenues while, at the same time, taking steps that would be desirable even if there was no budget deficit. Here is the package that budget negotiators should settle on."
"“It’s a very quiet market,” said James R. Capra, a senior vice president at Shearson Lehman Government Securities. “Caution and profit taking are the watchwords of the day. The market has come a long way, and | there is a big number on Friday. At I this point people are unwilling to make purchases.”"
Most economists are expecting the employment numbers will show that economic conditions deteriorated further last month. A sharp decline in non-farm payroll employment and a fairly sizable increase in the unemployment rate are anticipated.
"A survey of economists about the employment report by MMS International, an economic information service company, shows that most are projecting a decline of 75,000 in nonfarm payroll employment and a rise in the unemployment rate to 5.9 percent, from 5.7 percent in October."
"A sharp fall in stock prices yesterday reflected growing worries over the health of the economy, especially the erosion of corporate profits, as well as a stock market that has grown increasingly fragile, some traders and analysts say."
"The rapid plunge in prices, which sent the Dow Jones industrial average down more than 100 points in little more than an hour of trading, only to stabilize and end the day down by 56.44 points, or 1.9 percent, at 2,904.70, came after a series of disappointing earnings reports from companies as diverse as Texas Instruments, the electronics company, and McDonald’s, the hamburger chain."
"Growing Apprehension The selling extended to virtually all stocks, with six stocks falling in price for every one that rose. The Standard & Poor’s 500-stock index fell by 6.30, or"
"The profit disappointments came at a time of growing apprehension about the health of the financial system — many large bank stocks are trading at their lowest levels in two years — that had generally not hurt the stock market up to now. While share prices were . | not as expensive, measured against ] such indicators as earnings and interest rates, as they were in the summer of 1987, they were approaching that level, according to many analysts."
"""The market had reached overvalued levels, the economy is sluggish, and corporate profits, while they are not horrendous, are well below the levels of expectations that were built into prices,” said Abby Joseph Cohen, the chief American strategist for Barclays de Zoete Wedd Research."
"According to the Congress’s bipartisan Joint Committee on Tax, the net effect of the Republican tax proposal would be tax increases for Americans with incomes under $50,000 while those with incomes above $50,000 would receive tax cuts. The committee said Americans with incomes over $200,000 a year would receive a tax cut totaling $7.4 billion in the first year."
"The latest proposal by Democrats included a 20 percent surtax on the income taxes paid by people with incomes of more than $500,000 a year. The Associated Press reported. It would also double the taxes on beer and wine, as well as increasing the levy on distilled spirits. Also citing estimates by the Joint Committee on Tax, The Associated Press said the Democratic offer would lower by $4 billion the taxes paid by people with incomes below $20,000, while boosting them by $26.8 billion for everyone else."
"WASHINGTON, Aug. 16 — A number of the country’s major railroads and railroad-related businesses are failing to pay large amounts of payroll taxes to the Federal Government to finance the unemployment, retirement and medical benefits for the industry’s workers, an audit indicates."
"There is a way to get the economy moving again fairly soon, but it is apparently not on anyone’s agenda. It is a tax on consumer spending — even in the face of the coming Presidential election."
With the recovery from the recession weak or nonexistent. White ouse and Congressional attention is on cutting taxes to stimulate the economy. But using tax cuts to give a short-run boost to the economy would be exactly the wrong way to try to cure the Government’s long-term fiscal problems.
"Because of the Reagan-era tax cuts and the absence of any consensus to cut spending, it appears that the Federal budget will be permanently in the red. According to the Congressional Budget Office, the deficit will still be 2 percent of the gross national product even after an economic recovery. Moreover, demand is growing for additional Federal spending, particularly for health care and edu-"
Policy makers thus face a dilemma. A tax cut is needed in the short run while an increase is required for the long run. But this trade-off can be avoided by a tax on consumption — a national sales tax — that would take effect on a specified date in the future.
"Suddenly politicians of every stripe are demanding a tax cut to ""fight the recession."" President Bush turned from opponent to enthusiast overnight. Democratic Congressional leaders called hearings for this week to explore their ideas and the President’s."
"The stampede tells us something about this country. It shows how addicted we are to fulfilling immediate desires, how unable to focus on longterm needs. It shows that we are still gripped by the faith of the Reagan years, though its ruinous effects are all about us: We believe that somewhere there is a free lunch."
"Cutting taxes now is a bad idea on every count. Because the Federal deficit is so high, everyone proposing a cut promises that his plan will . produce no net loss to the Treasury. If that is so, there will be no stimulus to the economy. Some other interest may be served — undoing the Reagan tax law’s tilt toward the rich, for example — but not fighting the recession."
"WASHINGTON. June 27 (AP) — The number of Americans filing new unemployment claims declined in the second week of June, the Labor Department reported today, supporting hopes the nation’s jobs market is on the upswing."
"“That trend was interrupted briefly,"" said David Jones, an economist with Aubrey G. Lanston & Company. “But it has been trending lower, suggesting that at least in some sectors, the jobs market is improving.”"
"Robert Dederick, chief economist at the Northern Trust Company of Chicago, said, “We’re having a gradual ebbing, and that's consistent with the idea of recovery and further evidence that it’s manifesting itself in a better labor market.”"
"The jobless-claims report, which can be erratic from week to week, helps economists analyze whether companies are adding or laying off workers. The latest number shows that jobs are probably on the rise, but only slightly, said Sam Kahan, chief financial economist at Fuji Securities."
"Property-tax delinquencies in New York City are rising again, as they did during the 1970’s, when the city last underwent an economic crisis. But city officials do not expect a recurrence of the wave of the abandonments that destroyed neighborhoods across the South Bronx the last time around."
City officials see the increase — 38 percent in the 12 months ended June 30 — as a result of the real-estate slump and the reluctance of banks to lend to developers. Landlords unable to pay their bills are in effect using the city as a bank: “borrowing” money by not paying property taxes.
"New York City’s economy is in trouble. Unemployment is up 25 percent this year; nearly a million New Yorkers are now on welfare, the most in 15 years. Financial firms, including Morgan Stanley, an industry leader, are pondering leaving. And many other employers express revulsion over filthy streets, crime, aggressive panhandling and soaring drug use."
"Just as city policies didn't create the economic mess, neither will they eradicate it. The forces driving companies out of central business districts to the suburbs and beyond may subside, even reverse. If so, the city government will be a spectator to these trends, not a prime mover."
